{
  "format": "wayfinder-contract-release",
  "schemaVersion": 1,
  "releaseId": "v1-candidate-revision-9",
  "status": "unactivated-frozen",
  "contractVersion": 1,
  "contractManifest": {
    "path": "assets/contract-v1/contract.json",
    "sha256": "3c79c6e1d2eae7c6016d789c9ade75125a2ec1dcc43f458541f9d7c63654bdd9"
  },
  "adapters": [
    {
      "id": "python-reference-v1",
      "path": "scripts/adapters/wayfinder.py",
      "sha256": "f8fe1a0987a37e8a9a43003ede1bcb9eda590c88511daebaafcdd5d13932337a"
    },
    {
      "id": "node-v1",
      "path": "scripts/adapters/wayfinder-node.mjs",
      "sha256": "df0f3c2a000454b2f7aaa8fcf6762b670aab34b9cb721da571fe334ae29f10ac"
    },
    {
      "id": "powershell-v1",
      "path": "scripts/adapters/wayfinder-powershell.ps1",
      "sha256": "b7f8687b5b4ede2bd124999c23aaa12681a07bddc0597255873fa9c4493fa8c9"
    }
  ],
  "certifications": []
}
